{
  "run_id": "contract_run_req_contract_001",
  "contract_id": "daily_owner_report_v0",
  "status": "completed",
  "result": {},
  "evidence": {
    "steps": [
      {
        "step_id": "step_001",
        "operation_id": "op_notify_webhook",
        "decision": "allow",
        "reason_code": "OPERATION_ALLOWED",
        "admission": {
          "decision": "allow",
          "reason_code": "OPERATION_ALLOWED",
          "allowed_connector_id": "connector.http.generic.v1",
          "allowed_endpoint_ref": "webhook_site_contract_run_test",
          "allowed_method": "POST"
        },
        "connector_summary": {
          "connector_id": "connector.http.generic.v1",
          "endpoint_ref": "webhook_site_contract_run_test",
          "method": "POST",
          "side_effect_intent": "external_network",
          "connector_status": "completed",
          "provider": "deterministic_local_http_generic",
          "connector_mode": "deterministic_local_http_generic",
          "response_preview": {
            "message": "contract-run smoke"
          },
          "attempts": 1,
          "timeout_ms": 10000
        }
      }
    ],
    "gates": [
      {
        "gate_id": "gate_contract_run_req_contract_001_step_002",
        "step_id": "step_002",
        "requested_operation_id": "op_send_report",
        "decision": "approve",
        "decided_by": "user_001",
        "reason_code": "HUMAN_GATE_APPROVED"
      }
    ],
    "transitions": [
      {
        "from_step_id": "step_001",
        "outcome": "default",
        "kind": "next_step",
        "target_step_id": "step_002",
        "terminal_status": null,
        "reason_code": "TRANSITION_APPLIED"
      },
      {
        "from_step_id": "step_002",
        "outcome": "approve",
        "kind": "next_step",
        "target_step_id": "step_003",
        "terminal_status": null,
        "reason_code": "TRANSITION_APPLIED"
      }
    ],
    "transition_failures": [
    ]
  },
  "trace_ref": "trace_contract_001",
  "observation_refs": [],
  "policy_summary": {
    "decision": "allow",
    "policy_version": "policy.default.v0",
    "reason_code": "CONTRACT_RUN_COMPLETED"
  }
}
